{
  "schema_version": "1.0.0",
  "$schema": "https://raw.githubusercontent.com/eva01/qs-data/master/schemas/price_table.schema.json",
  "category": "labour-rates",
  "data_type": "price_table",
  "source": {
    "image": "whatsapp-image-2026-05-16-at-12-14-09.jpeg",
    "url": "https://quantitysurveyoronline.com.my/labour-rates.html"
  },
  "data_date": "2016-05-26",
  "extracted_at": "2026-05-18T03:42:59Z",
  "extraction": {
    "ocr_engine": "gemini"
  },
  "currency": "MYR",
  "unit_system": "metric",
  "row_count": 1,
  "quality_flags": [],
  "rows": [
    {
      "row_id": "labour-rates:_:1",
      "section": "_",
      "section_name": "",
      "item_no": "1",
      "description": "Rumah Teres 1 Tingkat (20' x 70')",
      "price": {
        "type": "tbd",
        "raw": "233,000"
      },
      "unit": "unit",
      "unit_raw": "unit",
      "remarks": "Harga dari"
    }
  ]
}