{
  "schema_version": "1.0.0",
  "$schema": "https://raw.githubusercontent.com/eva01/qs-data/master/schemas/price_table.schema.json",
  "category": "materials-prices",
  "data_type": "price_table",
  "source": {
    "image": "whatsapp-image-2026-05-16-at-12-14-09.jpeg",
    "url": "https://quantitysurveyoronline.com.my/materials-prices.html"
  },
  "data_date": "2016-05-26",
  "extracted_at": "2026-05-18T03:42:56Z",
  "extraction": {
    "ocr_engine": "gemini"
  },
  "currency": "MYR",
  "unit_system": "metric",
  "row_count": 6,
  "quality_flags": [],
  "rows": [
    {
      "row_id": "materials-prices:_:_1",
      "section": "_",
      "section_name": "",
      "item_no": "_1",
      "description": "TAMAN REMBIA DAMAI, MELAKA",
      "price": {
        "type": "tbd",
        "raw": ""
      },
      "unit": "—",
      "unit_raw": "",
      "needs_review": true
    },
    {
      "row_id": "materials-prices:_:_2",
      "section": "_",
      "section_name": "",
      "item_no": "_2",
      "description": "PPAM (Perumahan Penjawat Awam Malaysia)",
      "price": {
        "type": "tbd",
        "raw": ""
      },
      "unit": "—",
      "unit_raw": "",
      "needs_review": true
    },
    {
      "row_id": "materials-prices:_:_3",
      "section": "_",
      "section_name": "",
      "item_no": "_3",
      "description": "Rumah Teres 1 Tingkat (20' x 70')",
      "price": {
        "type": "tbd",
        "raw": "233,000"
      },
      "unit": "unit",
      "unit_raw": "unit",
      "remarks": "Harga dari RM 233,000 (Asal RM 288,000)"
    },
    {
      "row_id": "materials-prices:_:_4",
      "section": "_",
      "section_name": "",
      "item_no": "_4",
      "description": "Bilik Tidur",
      "price": {
        "type": "tbd",
        "raw": "4"
      },
      "unit": "nr",
      "unit_raw": "nr"
    },
    {
      "row_id": "materials-prices:_:_5",
      "section": "_",
      "section_name": "",
      "item_no": "_5",
      "description": "Bilik Air",
      "price": {
        "type": "tbd",
        "raw": "2"
      },
      "unit": "nr",
      "unit_raw": "nr"
    },
    {
      "row_id": "materials-prices:_:_6",
      "section": "_",
      "section_name": "",
      "item_no": "_6",
      "description": "Jumlah Unit",
      "price": {
        "type": "tbd",
        "raw": "19"
      },
      "unit": "nr",
      "unit_raw": "nr",
      "remarks": "HANYA 19 UNIT SAHAJA"
    }
  ]
}