{
  "schema_version": "1.0.0",
  "$schema": "https://raw.githubusercontent.com/eva01/qs-data/master/schemas/price_table.schema.json",
  "category": "plant-equipment-rates",
  "data_type": "price_table",
  "source": {
    "image": "whatsapp-image-2026-05-16-at-12-14-09.jpeg",
    "url": "https://quantitysurveyoronline.com.my/plant-equipment-rates.html"
  },
  "data_date": "2016-05-26",
  "extracted_at": "2026-05-18T03:43:19Z",
  "extraction": {
    "ocr_engine": "gemini"
  },
  "currency": "MYR",
  "unit_system": "metric",
  "row_count": 7,
  "quality_flags": [],
  "rows": [
    {
      "row_id": "plant-equipment-rates:_:_1",
      "section": "_",
      "section_name": "",
      "item_no": "_1",
      "description": "TAMAN REMBIA DAMAI, MELAKA",
      "price": {
        "type": "tbd",
        "raw": ""
      },
      "unit": "—",
      "unit_raw": "",
      "needs_review": true
    },
    {
      "row_id": "plant-equipment-rates:_:_2",
      "section": "_",
      "section_name": "",
      "item_no": "_2",
      "description": "Rumah Teres 1 Tingkat (20' x 70')",
      "price": {
        "type": "tbd",
        "raw": "233,000"
      },
      "unit": "unit",
      "unit_raw": "unit",
      "remarks": "Harga dari RM233 Ribu"
    },
    {
      "row_id": "plant-equipment-rates:_:_3",
      "section": "_",
      "section_name": "",
      "item_no": "_3",
      "description": "PPAM (Perumahan Penjawat Awam Malaysia)",
      "price": {
        "type": "tbd",
        "raw": ""
      },
      "unit": "—",
      "unit_raw": "",
      "remarks": "Eksklusif untuk Penjawat Awam Sahaja",
      "needs_review": true
    },
    {
      "row_id": "plant-equipment-rates:_:_4",
      "section": "_",
      "section_name": "",
      "item_no": "_4",
      "description": "Bilangan Unit",
      "price": {
        "type": "tbd",
        "raw": "19"
      },
      "unit": "unit",
      "unit_raw": "unit",
      "remarks": "Hanya 19 unit sahaja"
    },
    {
      "row_id": "plant-equipment-rates:_:_5",
      "section": "_",
      "section_name": "",
      "item_no": "_5",
      "description": "Spesifikasi Bilik",
      "price": {
        "type": "tbd",
        "raw": "4"
      },
      "unit": "bilik",
      "unit_raw": "bilik"
    },
    {
      "row_id": "plant-equipment-rates:_:_6",
      "section": "_",
      "section_name": "",
      "item_no": "_6",
      "description": "Spesifikasi Bilik Air",
      "price": {
        "type": "tbd",
        "raw": "2"
      },
      "unit": "bilik air",
      "unit_raw": "bilik air"
    },
    {
      "row_id": "plant-equipment-rates:_:_7",
      "section": "_",
      "section_name": "",
      "item_no": "_7",
      "description": "Status Hak Milik",
      "price": {
        "type": "tbd",
        "raw": "Kekal"
      },
      "unit": "-",
      "unit_raw": "-",
      "remarks": "Hak Milik Kekal"
    }
  ]
}